output-filename	fileId	status	niko-label	utterance-count	evidence
2025-05-14_workshop-day-one.md	1DqNqXmYjXggIiE5qdB8SgaKVFaL8_U6Nz9F5nEL0LRE	EXTRACTED	Nikolas	162	Speaker labeled **Nikolas** throughout; opens session as coach discussing overdrive as default mode and self-care as counterbalance
2025-05-15_workshop-day-two.md	152_MQPjMgJKE5bf901X3etSsbBYo628J95VpjXiXeTw	NO_SPEAKER_LABELS	n/a	0	Only **HH:MM:SS** timestamp blocks (535) with no speaker names; no attribution possible
2025-05-16_workshop-day-three.md	1UWhgiSFNNu1bK_XPNyGd8f86jF-qQiEz4W0nRQc2U1E	EXTRACTED	Nikolas	177	Speaker labeled **Nikolas** from line ~443 onward; first ~400 lines are an unlabeled Erwin monologue; Nikolas acts as coach
2025-05_workshop-day-three-b.md	1AAD2p6T2p-GBXxKVFEoGb38urbIlnt7Andy9UoHarVs	NO_SPEAKER_LABELS	n/a	0	Two sessions dated 2025-03-26 with only timestamp blocks (642), no speaker names; distinct content from file 3, not a duplicate
2025-04-23_sven-live-eo.md	1ggn6hsOcfPBxxW0GlRKHCfQJPJ2RZ7Evi4kMbOrtreg	NO_SPEAKER_LABELS	n/a	0	Continuous merged German/English text with no per-utterance speaker labels or timestamps
2025-04-24_danil.md	1SJ6zVptNivCCwzXBenlnucYdIcBEv-S_wjMV8vgq9ac	NO_SPEAKER_LABELS	n/a	0	Continuous merged text, single session block, no speaker attribution markers
2025-03-27_meeting-ai-transformation.md	1S2gzLaaafCCy1kDCVv_HDj2hpeVf20UzN2WBK1OCf3U	NO_SPEAKER_LABELS	n/a	0	Continuous merged text with no speaker labels; Nico addressed directly confirming presence but utterances cannot be attributed
